"vid","col0","col1","col2","col3","col4","col5","col6","col7","col8","col9","subj","BARS"
"08_segment-02","Working in the resolutions department, we come across a variety of different issues and and errors that come about through the various different testing streams that we accommodate and help","support. When these errors occur, uh it creates a uh large amount of additional work, it creates manual intervention, quality control, other sorts of actions that you need to take to remediate","the situation and uh successfully deliver a finished product or scores or whatever you are looking to accomplish. uh Most of the time um when we have these issues we need to rally a large","quantity of staff to perform sometimes road exercises in terms of quality control or updating of certain records or demographic information. When you get that large group together, you really","need to have a goal in mind and [it's] clear thought process of how you're going to tackle these large scale projects. Because often times you are under a strict time constrain. Motivating staff","is really important in this because you have to make sure everyone is continually moving forward with the project and constantly keeps their eye on short term goals to accumulate successes to get","this uh overarching project, this issue wrapped up and resolved. um A lot of the things that we do to make sure staff gets motivated might seem quite simple but um really goes a long way to","making sure everyone feels valued and understands the importance of this. uh We do our absolute best to make sure people totally understand the plan and the course of action, so that they feel","involved in the thought process and the execution of it. We make sure that if the situation warrants that we uh purchase food for people, uh provide lunch, provide dinner if it's working late at","night. uh When we end large scale projects, we have to give small awards and other things. So we build this cheered motivation uh through out the whole project to make sure everyone is moving at",8,6.2
"08_segment-03","In a lot of my course work I did a writer at night. um It was a very interesting environment, we had a large quantity of uh students from varying different backgrounds. Whether they'd be full time","students or were just taking night classes, whether they'd be uh students that were fully employed working at night, um continuing education students um you know people coming back to school after","large uh absences. And often associated with these courses especially in the business and management courses I was taking, uh a large quantity of those had group projects associated with them. So","these group projects where we take all these different people from all these different backgrounds and we put them together. There was often times a lot of conflict, you had people that had various","different work ethics, various different understanding of a subject matter, uh different levels of commitment to the project um and it created a lot of attention and I've had multiple situations","where we had multiple team members who did not get along for that particular project. One of the things I always look at when you get in those situations is really focus on what it is we are","actually doing in the project. What are the tasks associated  with that person, what are things that they are responsible for and what is really necessary for these team members to produce to create","a successful project? You really have to break yourself away from the personal issues of it. You can never know why someone may not be agreeing with you, why someone may not be as committed, why","maybe someone has some drastically different view point. When you are in these project situations and these groups, you really need to focus on what that project is and the understanding of people's","different life situations and come up with a clear cut plan of what exactly each person needs to put together and uh add into the project so that they can complete it as a group and uh make a",8,5.1
"08_segment-04","I've been a member of uh the test taker resolution services for about seven or eight years now, and over the course of that tenure, we've had a lot of different changes that have taken place that","we've had to communicate to staff a variety of different levels. Where this comes into the negotiation part, is that often times when changes occur, especially organization changes, shifting","responsibilities or programs, it's very similar to a negotiation when you meet a variety of different staff about it. Because you are trying to negotiate with them to have them buy into this new","idea and a key component of whether or not they're going to buy into this, is whether or not they trust you. The trust part is I think the most critical part in negotiation in general but","especially when it comes to things like changes. Trust is something that you have to, they had to build over time um and it's something you have to work on and show results, show clear cut results","uh based upon actions, promises, uh conversations that you have. And it doesn't necessarily have to be a long amount of time depending on what the type of negotiation is, we are talking about","making organizational changes or trying to communicate things to staff. That level of trust has built over a longer period of time, so that when we go and we communicate these things, you are going","to leverage that trust that you build up to get people to negotiate with them to buy into the fact that these changes that we are making is either good for everyone or good for these people or good","for these program. For other items, uh smaller term negotiations it may just be as simple as uh you follow it up on the email that you said you were going to so that when you call your prospective","client back and you start negotiating with them more, they trust that at least in the first instance you followed up and you said, you did what you said you were going to do. um So that might be",8,5
"08_segment-05","Anytime you want to ask me a question about bargaining or compromising, one thing I always think about is when uh you go and you purchase a car. uh About a year and a half ago, two years ago in","two thousand twelve. I went and I purchased a new car. So I go into the lot and I find a car and I like this car and this is the car I want. I looked at a few other cars and I said no, this one","car this one dealership, this is the car I want. So I'm now in the situation where I have someone else to sell me a car, I have a car I want to buy. The car is in the lot and I have the money. So","we sit down and they start giving you all these information about all sorts of things, how they come up with their price, what are all these services, what are these packages, how does this","package link to this other package, why you need this service or this add on. um I remember sitting there for a good hour listening to all this and you're trying to scramble and you are asking","all these questions. But really what came down to is what do I want to pay? Right. I kind of took a step back and said okay, what do I want out of this? What is the most important thing to me?","And I said okay I want the cheapest price possible. Well and what's the most important thing for mumble across the way for me, right which is to make a profit not only his company but himself? So","I kind of realized in that situation okay, at some level he needs to make money and at some level I need a good price. So once I decided what I want in terms of the price and said this is what I","feel comfortable paying, what can you do to make that happen? He was about to construct a deal that will end up enough with my goals, where I got out of it what I wanted, and I was happy with","what I was paying. Regardless of any of the other factors I was okay with it and he got out of it what he needed which was he structured a deal that was going to make him look good or whatever",8,5.8
"08_segment-06","This is a topic I feel really comfortable talking about, uh in my tenure we've had a lot of different um issues or requests for changes. And anytime that happens, a major component","in the request for change involves processes designed and system architecture and making changes to certain things. Often certain times when you get in these situations, you have","different groups within your organization that have different ideas about how they should proceed with the change. Part of my role through out my career has been to develop these","changes reviewing them with different groups and getting them to buy in with, this is the proposal that we need to go with. There is a few ways that uh I feel that I do extremely","extremely well at to make that happen. One I'm a firm believer that you really need to understand the subject matter of what you're talking about. Why you're making these changes and","what exactly is your change going to do to fix um that problem. Every proposal out there is basically to change or fix an existing problem, or do something better. So if you really","understand the subject matter and you really understand exactly what your change is going to do. Then the next step really is to clearly communicate that to an appropriate audience.","Being able to change your message whether it be to lowest level of technology people or high level executives um and then be ready and prepared to defend and respond to questions and","inquiries uh about your particular proposal or change or contractor, whatever the situation is. But I think it all really goes back to subject matter, really being the subject matter","expert and kind of going back to what we talked about before, if you can build trust through subject matter expertise, people are going to be more likely to buy into your proposal",8,5.8
"08_segment-07","I think you're going to have a lot of situations occur where you are going to have to work with people that you don't get along with. And dealing","with that is a huge component to success. I believe a major contributor to how successful you're going to be is what is the variety of people that","you can work with. Because if you can work with a variety of people, then you can leverage a variety of skills knowledge based expertise, to uh","loop into project or assessment based work, and produce the best results possible. When you come across people that don't, aren't traditionally","people that others enjoy working for. I think the key is to differentiate those individuals that really have a firm grasp of the knowledge and or","has a firm, a large amount of expertise, and really determining out of these individuals that who I don't particularly enjoy working with, what","are the things that I know I can rely on them to do?  What are the things that I can respect them and acknowledge in them that they do well and","what can I focus on to make the relationship as positive as possible? Even if they're items that I don't particularly care for, um maybe there is","other parts of these people that I can really um leverage and really use and try to focus on that and really just keep everything on a forward","looking um progression so that you're constantly looking towards the next goal and you're not overly criticizing people for previous mistakes or",8,5.4
"08_segment-08","I don't think I have a personal situation where I was involved in something like this. So instead let me tell you the advise that I would give to an employee of mine","or a prospective ah friend or colleague who is looking for a job or was in a new role. So if you are in a situation that you feel that you are, for anything maybe it's","not even unpleasant task that you are getting more work or more responsibility or more um tedious or demanding work than other employees. My advice to people is always","to keep an open line of communication with your direct management. A lot of times people can get myopic in their focus and often times they are not in the position to","truly understand why um certain decisions are being made, so it's very possible that there is a really good reason why you might have a different set of task than","other people and it might actually be a good thing that you are getting more of the unpleasant task, than another person. If these tedious boring tasks involve a lot","of subject matter and quality control, it might be because your manager, or your supervisors really value this work that you are doing and you are able to show this","great results. um I think that if you keep the line of communication open, and when you talk about it, if you talk about it in a positive way, and in a way that says I","just want open communication about this, I'm here as a team player and always position yourself as a team player. I think that you'll gain the acknowledgment that you","want, that you'll really get a good understanding and it'll help move your career forward because your manager will see how you are able to communicate in a",8,5
"08_segment-09","Again I don't believe I have a personal story to share about this particular situation, so I'll speak about this in a broader sense and some of my view points on","this sort of situation. Uh I firmly believe that leaders especially uh those that are placed in the leadership of a group, do have some leeway to make changes,","and often times they need to make changes. With that being said there is always a give and take in terms of of how drastic the change need to be and what input","the leader gets from those uh contributions. I think from the view point of someone who is part of this group, and has made contributions, when the leadership","changes and a change of direction is made, I think that it's an opportunity to really make some critical self reflection and say, is this really the right","direction for the group? Does this change or the uh dropping of certain contributions, uh does this actually make more sense? Is the new opinion or the new","direction better than the previous direction or is it just different? And you know if it's different, can you still be a part of that, can you still buy into","that. Your job is to be a team player, your job is to uh be part of this project to show results, to solve the problem or issues or service the client that your","company has put you in uh and uh part of the job is to work with the leadership in accordance with that. You know as long the direction and the vision that you're","moving forward accomplishes some of those goals even though some contributions were dropped, I think that if you look hard enough you can find ways to buy into",8,3.8
"08_segment-10","In test taker services we use a large amount of agency staff due to the peaks and valleys of our processes and cycles and the programs that we support. With this influx of","new staff uhwe have to be very adapt to training staff, bring them on board, teaching them subject matter knowledge that they need to do, communicating with them and","telling them exactly what the tasks are that we need to accomplish. Through that exchange, often times we have communication issues and minor communication problems and me","personally as a manager in test taker services I often have to rely on my listening skills to really take a moment and hear the issues or the complaints that people are","bringing to me. To really dissect and figure out what is the root nature of the problem. Because often times the proceed problem even from the staff that may be bringing to","you is very different than the actual problem at its core. In a situation a few weeks ago, that agency staff really upset and as I was listening to him describe the","situation and describe what was happening, I really started to realize that the root issue wasn't about the another staff's attitude or what was being said to them, it was","really about how they felt that another agency staff at their level was taking a leadership role that they felt that shouldn't be taken. Which is very different than the","message they were communicating. So really listening and analyzing and hearing out what people are saying to you. That's how you can break down these communication","problems, that's how you're going to really get to the root causes of some of these issues and potentially you can really spear head and head some things off that would",8,6
"08_segment-11","In resolutions we have a large amount of manual processes and a lot of these manual processes affects scores. we produce scores, quality control scores, then make updates to the","records. Anytime we have these manual processes, not often but there comes instances where errors that come out of these manual processes and incorrect scores get produced. This","creates a very uh tense situation especially when myself as a manager reading from my previous experience as a program coordinator, would get all the information about an error and","then would have to go and communicate that not only to my direct supervisor but also top level management. And it can be very stressful and it can be very uh sensitive. One of the","the things I feel that is really important when delivering this type of issue is really understanding the scope of the issue, and really understanding what needs to happen to","contain the issue. Anytime that there is an issue that arises you have to communicate this type of information, you need to be able to assure people that you fully understand how","big the issue is and what exactly are the steps that you're going to have to contain it. Once you can do that, that's when you can add in the subject matter and the knowledge base","that you have and leverage that to really start building trust with these individuals, to try to get them to buy into the fact that you have a firm understanding of the the","situation. You know every step you need to take to resolve the situation, and they can feel comfortable with allowing you to take those steps necessary to resolve the situation.","Then if you find out through out the process, there are items that you need or there are things that you need help with, when you go and request for aid, people will be much more",8,5.7
"08_segment-12","One of the skills I feel that I have learned in my career at ETS is the ability to communicate the same message to a variety of different audiences and a variety of","different skill level. In my current role, I speak to agency staff that have months worth of experience with us. I speak with entry level ETS regular staff, I speak","with midtear ETS staff, I speak with ETS upper management, I communicate with vendors. A variety of different audiences with a vastly different realm of technical","expertise, and knowledge specially to our process. uh When I come across these situations where I need to explain these technical or complex items to audiences I feel","that may or may not be as technical, I try to break things down to the process level. Explain things in a work flow that moves from step to step to step or process to","process to process. So that people can visualize exactly what I'm talking about. Another strategy I use is often times when I speak and I'm explaining subjects, I'll","pause and ask if what I'm saying makes sense. You know if I explain that we need to do this to a record and then we're going to produce a score report does that make","sense? Is what I'm saying connect the dots? So that you don't get to the end of an explanation and realize your audience was really lost, you are much higher up","stream. Take different points of the conversation, stop and pause and make sure that you verbally ask for acknowledgment that what you're saying is making sense on","that they are fully understanding what you're trying to communicate to them. I feel that's really affective in getting non-technical staff familiar and understanding",8,5.7
"09_segment-01","uh When I first began my teaching career uh I was at an independent school in New York City. And um I had entered into a foreign language department that was, um I","would say quite antiquated in some ways. And we needed to um take a look at the curriculum that we were using and potentially look at new text book uh adoption. So","although I was a new teacher I had gone through many teacher training classes. I had decided to uh sort of take the lead on reviewing text books, contacting the","publishers and doing a formal review of the text books that were currently in um the field at that time. uh That was very much when uh we were going into a lot of","using authentic materials in uh foreign language teaching. um I did a thorough review of approximately five different um text books from different editors and uh","at that point I had come to, I had to design a rubric that I used for the evaluation. um I then made a presentation um to my committee and to my colleagues. uh","Because you wanted to use it primarily for French which was my field. But the department chair also felt it was important that if we were going to make a change","that we could make the change across the board for all the Romance languages at that point. Which would have been French, German, Spanish and Italian. So I made a","form presentation to them, I presented the, uh my selected choice that I thought fit the criteria that we were looking for for the department. And then the","committee at that point uh decided to make a decision and um I was pleasantly surprised that they did agree and we did adopt this new formal um text book to be",9,6.3
"09_segment-02","uh During my career I spent uh several years as a head of an upper school in an independent school system. And um at that time we always had parent teacher conferences. And","these were the typical sort of led by the uh advisor of the student and the parents would come in, the student would be there. And it ended up being very much where the parent","and the uh teacher were having much more of the discussion and the student played a very uh background uh situation. Teachers at one point really were losing interest in this","advisory system. But I felt that as the leader of the division it was very important for us to have a program that was functional, that worked and that um actually focused on","the student. So what I had done was at that point I decided let's switch the roles of how we would have these advisory meetings. And we made them more student led so that the","student would be the one that would carry on the conversation. um And prior to those meetings there would be um specific tasks that each student would have to do in order to","prepare. They needed to set personal goals, academic goals, they needed to take a look at what they were hoping to accomplish for the year. uh What they envisioned might be","some of their pitfalls or some of their strengths. So that when we had the meeting, uh which happened actually twice a year. um It then became student led so that the student","was the one who was talking directly to the parent and he teacher then really became more of an advisor. So that they would interject from time to time, add some information.","But really it was a student having a strong discussion with the parents. Which was rather new since um that was not happening in the past and it gave the families some good",9,4.4
"09_segment-03","Uh during my career in education I was on several self studies of uh schools. And in one particular case I was at a uh school that was in uh the state of Arkansas.","And it was an independent school that was military based. There were three of us on this committee and we were looking at the governance section of the school. And a","portion of that also dealt with the student discipline. Um it was interesting in the fact that at this time and this was uh still dealing I would say in the nineteen","nineties. That there was corporal punishment being used at this institution. Uh And there was very much carry over from the uh military side of the institution. Uh My","other two colleagues had a very difficult time dealing with this. And they had um we spent many time in not really accomplish much, but more sort of in heavy duty","discussion. And so I thought one of the steps that we could take in order to complete the task of doing the review was, uh I had looked at what we needed to cover, I","broke it down into three distinct areas so that each one of us would be in charge of or responsible for one portion of the self study that we were doing. So that when","we came back at the end we then could share what we had discovered on our own private interviews, our own research. And then get together and to write up the section","that we needed to prepare for the self study. Um this way the other two members although they did not work well together on one project but when they each had their","individual piece. And then was able to work as a group and we all had to formulate the uh project and putting together on paper uh the recommendations that worked out",9,5.1
